{
  "specversion": "1.0",
  "id": "0190a1b2-3c4d-7e8f-9a0b-1c2d3e4f5a6f",
  "source": "urn:aerial-rescue:drone:drone-vision-01",
  "type": "aerial-rescue.v1.drone.command-result",
  "subject": "m-2026-0001",
  "time": "2026-08-23T07:31:05.117Z",
  "datacontenttype": "application/json",
  "dataschema": "https://aerial-rescue.invalid/schemas/v1/payload/drone-telemetry.schema.json",
  "data": {
    "missionId": "m-2026-0001",
    "droneId": "drone-vision-01",
    "commandId": "cmd-2026-0001",
    "outcome": "acknowledged"
  },
  "sequence": "000000000000044",
  "correlationid": "c-2026-0001",
  "causationid": "0190a1b2-3c4d-7e8f-9a0b-1c2d3e4f5a6e",
  "traceparent": "00-4bf92f3577b34da6a3ce929d0e0e4739-b7ad6b7169203335-01"
}
