{
  "specversion": "1.0",
  "id": "0190a1b2-3c4d-7e8f-9a0b-1c2d3e4f5a6c",
  "source": "urn:aerial-rescue:drone:drone-vision-01",
  "type": "aerial-rescue.v1.drone.event.salient",
  "subject": "m-2026-0001",
  "time": "2026-08-21T18:42:11.004Z",
  "datacontenttype": "application/json",
  "dataschema": "https://aerial-rescue.invalid/schemas/v1/payload/drone-telemetry.schema.json",
  "data": {
    "missionId": "m-2026-0001",
    "droneId": "drone-vision-01",
    "observation": "thermal-contact",
    "latitudeMicrodegrees": 47123901,
    "longitudeMicrodegrees": -122653114,
    "detail": "A persistent warm signature under canopy, held across three passes."
  },
  "sequence": "000000000000043",
  "correlationid": "c-2026-0001",
  "traceparent": "00-4bf92f3577b34da6a3ce929d0e0e4736-b7ad6b7169203332-01"
}
