{
  "specversion": "1.0",
  "id": "event-drone-command-escalate-0001",
  "source": "urn:aerial-rescue:command-gateway:gateway-synthetic-01",
  "type": "aerial-rescue.v1.drone.command.escalate-rescue",
  "subject": "mission-synthetic-0001",
  "time": "2026-08-25T12:05:00.000Z",
  "datacontenttype": "application/json",
  "dataschema": "https://aerial-rescue.invalid/schemas/v1/payload/drone-command-escalate-rescue.schema.json",
  "data": {
    "missionId": "mission-synthetic-0001",
    "droneId": "drone-synthetic-01",
    "commandId": "command-synthetic-0002",
    "approvalId": "approval-synthetic-0001",
    "proposalId": "proposal-synthetic-0001",
    "proposalDigest": "e3b6c8a4c2a075031275dc288bad3f780c992338617978dcb5863bc51aa6f761",
    "proposalVersion": 1,
    "evidenceDecisionId": "decision-synthetic-0001",
    "evidenceDecisionDigest": "3c3775801fc324695e0f1eca64cf8fa91d6f213eec7968c71ffe8db61ce6abe3",
    "evidenceDecisionVersion": 1,
    "latitudeMicrodegrees": 45123456,
    "longitudeMicrodegrees": -75123456
  },
  "sequence": "000000000000010",
  "correlationid": "correlation-synthetic-0001",
  "traceparent": "00-4bf92f3577b34da6a3ce929d0e0e4738-b7ad6b7169203334-01"
}
