{
  "specversion": "1.0",
  "id": "0190a1b2-3c4d-7e8f-9a0b-1c2d3e4f5a72",
  "source": "urn:aerial-rescue:sector-lifecycle:run-synthetic-0001",
  "type": "aerial-rescue.v1.mission.event.lifecycle",
  "subject": "mission-01",
  "time": "2026-08-25T14:00:01.000Z",
  "datacontenttype": "application/json",
  "dataschema": "https://aerial-rescue.invalid/schemas/v1/payload/mission-event-lifecycle.schema.json",
  "data": {
    "missionId": "mission-01",
    "lifecycle": "SEARCHING"
  },
  "sequence": "000000000000001",
  "correlationid": "run-synthetic-0001",
  "traceparent": "00-4bf92f3577b34da6a3ce929d0e0e4736-b7ad6b7169203332-01"
}
