{
  "specversion": "1.0",
  "id": "0190a1b2-3c4d-7e8f-9a0b-1c2d3e4f5a6e",
  "source": "urn:aerial-rescue:service:command-gateway",
  "type": "aerial-rescue.v1.drone.command.assign-sector",
  "subject": "m-2026-0001",
  "time": "2026-08-23T07:31:04.882Z",
  "datacontenttype": "application/json",
  "dataschema": "https://aerial-rescue.invalid/schemas/v1/payload/drone-command-assign-sector.schema.json",
  "data": {
    "missionId": "m-2026-0001",
    "droneId": "drone-vision-01",
    "commandId": "cmd-2026-0001",
    "sectorId": "sector-04"
  },
  "sequence": "000000000000002",
  "correlationid": "c-2026-0001",
  "traceparent": "00-4bf92f3577b34da6a3ce929d0e0e4738-b7ad6b7169203334-01"
}
